name,comment,time,image
James Jūdgês,"https://www.thestar.com.my/.../e-hailing-and-taxis-to-be.../ https://www.thestar.com.my/.../e-hailing-and-taxis-to-be.../ E-hailing and taxis subject to same rules from July 12, with one-year grace period - Nation | The Star Online  · Like · ·",1531315977,https://external.fkul14-1.fna.fbcdn.net/safe_image.php?d=AQB90cHBcVFeuar-&w=294&h=294&url=https%3A%2F%2Fwww.thestar.com.my%2F%7E%2Fmedia%2Fonline%2F2018%2F06%2F28%2F10%2F55%2Fanthony-loke-2.ashx%2F%3Fw%3D620%26h%3D413%26crop%3D1%26hash%3D0DFFF06772B44A1419B3338F43A01B78EE79A163&cfs=1&sx=97&sy=0&sw=413&sh=413&_nc_hash=AQANgXus9AaskqM3
Yen Khim Lim,"Hello grab! I had problem in setting grab pay wallet since 8June. I had sent in almost 10 emails to your customer service help desk, but my problem still cannot resolve. And your officer keep on ask me to remove the apps and reinstall back the apps. It take almost one month, but my problem still unsolved. Can you assist me? Hello grab! I had problem in setting grab pay wallet since 8June. I had sent in almost 10 emails to your customer service help desk, but my problem still cannot resolve. And your officer keep on ask me to remove the apps and reinstall back the apps. It take almost one month, but my problem still unsolved. Can you assist me? Hello grab! I had problem in setting grab pay wallet since 8June. I had sent in almost 10 emails to your customer service help desk, but my problem still cannot resolve. And your officer keep on ask me to remove the apps and reinstall back the apps. It take almost one month, but my problem still unsolved. Can you assist me? · Like · ·",1531418778,
Kin Rahza,"Dear Grab, I heard that you reduced a 15% price fares for rider starting 12th July but how about 25% commission for the drivers?.. Why not reduced it 15% too...? Dear Grab, I heard that you reduced a 15% price fares for rider starting 12th July but how about 25% commission for the drivers?.. Why not reduced it 15% too...? Dear Grab, I heard that you reduced a 15% price fares for rider starting 12th July but how about 25% commission for the drivers?.. Why not reduced it 15% too...? · Like · · ·",1531398860,
Grab,"Author  Hi Kin,  thank you for reaching out to Grab. This is for selected cities around Malaysia while our prices are subjected to flexible real time pricing subjected to the supply and demand. As for the commission deduction for driver will still remain as stipulated. We hope this clarifies. Hi Kin,  thank you for reaching out to Grab. This is for selected cities around Malaysia while our prices are subjected to flexible real time pricing subjected to the supply and demand. As for the commission deduction for driver will still remain as stipulated. We hope this clarifies. Hi Kin,  thank you for reaching out to Grab. This is for selected cities around Malaysia while our prices are subjected to flexible real time pricing subjected to the supply and demand. As for the commission deduction for driver will still remain as stipulated. We hope this clarifies. · Like · ·",1531399812,/images/assets_DO_NOT_HARDCODE/facebook_icons/microphone-karaoke_filled_12_fds-spectrum-blue-gray.png
Reza Arman,Grab which selected cities with 15% fare drop ? Grab which selected cities with 15% fare drop ? which selected cities with 15% fare drop ? · Like · ·,1531433248,
,,,
Leo Leong,"Please fix the account register message code number, is not working Please fix the account register message code number, is not working Please fix the account register message code number, is not working · Like · ·",1531275654,
Grab,"Author  Hi Leo, we are so sorry about that. Please PM us your mobile number and email address so we can check on this. Hi Leo, we are so sorry about that. Please PM us your mobile number and email address so we can check on this. Hi Leo, we are so sorry about that. Please PM us your mobile number and email address so we can check on this. · Like · ·",1531275852,/images/assets_DO_NOT_HARDCODE/facebook_icons/microphone-karaoke_filled_12_fds-spectrum-blue-gray.png
Ong Eng Sian,I can't use neither grab pay nor grab wallet with my card. What to do? I can't use neither grab pay nor grab wallet with my card. What to do? I can't use neither grab pay nor grab wallet with my card. What to do? · Like · ·,1531317158,
Grab,Author  Hi Ong Eng Sian. Thank you for reaching out to Grab. Kindly PM us with your contact number in order for us to assist you accordingly. Thank you. Hi Ong Eng Sian. Thank you for reaching out to Grab. Kindly PM us with your contact number in order for us to assist you accordingly. Thank you. Hi Ong Eng Sian. Thank you for reaching out to Grab. Kindly PM us with your contact number in order for us to assist you accordingly. Thank you. · Like · ·,1531333161,/images/assets_DO_NOT_HARDCODE/facebook_icons/microphone-karaoke_filled_12_fds-spectrum-blue-gray.png
Kok Wai Viviwill,what happen can not cash out for grab pay credit? what happen can not cash out for grab pay credit? what happen can not cash out for grab pay credit? · Like · · ·,1531231522,
Grab,"Author  Hi Kok, thank you for reaching out to Grab. Please PM us your mobile number and email ID so that we may assist on this accordingly. Hi Kok, thank you for reaching out to Grab. Please PM us your mobile number and email ID so that we may assist on this accordingly. Hi Kok, thank you for reaching out to Grab. Please PM us your mobile number and email ID so that we may assist on this accordingly. · Like · ·",1531233899,/images/assets_DO_NOT_HARDCODE/facebook_icons/microphone-karaoke_filled_12_fds-spectrum-blue-gray.png
Vicknesh Sanmugam,"GrabIf a driver fail his background check and took effort to go all the way to grab office to know the reason, will you treat him like shit?You literally did that. GrabIf a driver fail his background check and took effort to go all the way to grab office to know the reason, will you treat him like shit?You literally did that. Grab If a driver fail his background check and took effort to go all the way to grab office to know the reason, will you treat him like shit? You literally did that. · Like · ·",1531283192,
Grab,"Author  Hi, we have responded to your PM. Thank you. Hi, we have responded to your PM. Thank you. Hi, we have responded to your PM. Thank you. · Like · ·",1531283571,/images/assets_DO_NOT_HARDCODE/facebook_icons/microphone-karaoke_filled_12_fds-spectrum-blue-gray.png
Areen Sajew,How to topap via in store? How to topap via in store? How to topap via in store? · Like · ·,1531282476,
Grab,"Author  Hi there, could you clarify if you are inquiring about GrabPay Credits top up or Driver's Credit wallet top up? Hi there, could you clarify if you are inquiring about GrabPay Credits top up or Driver's Credit wallet top up? Hi there, could you clarify if you are inquiring about GrabPay Credits top up or Driver's Credit wallet top up? · Like · ·",1531283108,/images/assets_DO_NOT_HARDCODE/facebook_icons/microphone-karaoke_filled_12_fds-spectrum-blue-gray.png
Areen Sajew,Grabpay credit. Grabpay credit. Grabpay credit. · Like · ·,1531284091,
Grab,Author  You may walk in to any of your nearest 7-11 stores an purchase the top up pin voucher for GrabPay credits. Please clarify with the cashier that the voucher you are purchasing is for GrabPay Credits and not Grab Driver Wallet top up. Thank you. You may walk in to any of your nearest 7-11 stores an purchase the top up pin voucher for GrabPay credits. Please clarify with the cashier that the voucher you are purchasing is for GrabPay Credits and not Grab Driver Wallet top up. Thank you. You may walk in to any of your nearest 7-11 stores an purchase the top up pin voucher for GrabPay credits. Please clarify with the cashier that the voucher you are purchasing is for GrabPay Credits and not Grab Driver Wallet top up. Thank you. · Like · ·,1531284798,/images/assets_DO_NOT_HARDCODE/facebook_icons/microphone-karaoke_filled_12_fds-spectrum-blue-gray.png
,,,
Putrina Mohamed Rafie,You know what would be nicer than this? For grabcar to finally accept my card so I can make payment. You know what would be nicer than this? For grabcar to finally accept my card so I can make payment. You know what would be nicer than this? For grabcar to finally accept my card so I can make payment. · Like · ·,1530798546,
Grab,"Author  Hi Putrina, thank you for reaching out to Grab. Please PM us your mobile number and email ID so that we may assist on this accordingly. Hi Putrina, thank you for reaching out to Grab. Please PM us your mobile number and email ID so that we may assist on this accordingly. Hi Putrina, thank you for reaching out to Grab. Please PM us your mobile number and email ID so that we may assist on this accordingly. · Like · ·",1530799777,/images/assets_DO_NOT_HARDCODE/facebook_icons/microphone-karaoke_filled_12_fds-spectrum-blue-gray.png
Ong Eng Sian,"""Finally"" mean? ""Finally"" mean? ""Finally"" mean? · Like · ·",1531317199,
,,,
Ramraj Sivagnanam,https://www.facebook.com/1501341690/posts/10211905793389164/ https://www.facebook.com/1501341690/posts/10211905793389164/ · Like · ·,1531567508,
Adam Tan,"Dear GRAB, now GOV want us to follow same ragulation with taxi...please fight for us same benifit like taxi too...! because now we are same pay for GOV PSV & PUSPAKOM, why not we can't get same benifit? some more GRAB fare is low not same like taxi...is very unfair! PLEASE FIGHT FOR ALL YOUR DEAREST DRIVER, WE WANT SAME BENIFIT LIKE TAXI! NOT ONLY REGULATIONS! THANK YOU GRAB! WE ALWAYS SUPPORT GRAB! Dear GRAB, now GOV want us to follow same ragulation with taxi...please fight for us same benifit like taxi too...! because now we are same pay for GOV PSV & PUSPAKOM, why not we can't get same benifit? some more GRAB fare is low not same like taxi...is very unfair! PLEASE FIGHT FOR ALL YOUR DEAREST DRIVER, WE WANT SAME BENIFIT LIKE TAXI! NOT ONLY REGULATIONS! THANK YOU GRAB! WE ALWAYS SUPPORT GRAB! Dear GRAB, now GOV want us to follow same ragulation with taxi...please fight for us same benifit like taxi too...! because now we are same pay for GOV PSV & PUSPAKOM, why not we can't get same benifit? some more GRAB fare is low not same like taxi...is very unfair! PLEASE FIGHT FOR ALL YOUR DEAREST DRIVER, WE WANT SAME BENIFIT LIKE TAXI! NOT ONLY REGULATIONS! THANK YOU GRAB! WE ALWAYS SUPPORT GRAB! · Like · ·",1531326719,
Ashley Gomez,GRAB service sucks! Drivers are rude AF! I miss uber! GRAB service sucks! Drivers are rude AF! I miss uber! GRAB service sucks! Drivers are rude AF! I miss uber! · Like · ·,1531516031,